"IndID";"Register";"IndTittel";"IndNavn";"MaalNivaaGronn";"MaalNivaaGul";"MaalRetn";"BeskrivelseKort";"BeskrivelseLang"
"norkari";"norkar";"Anbefalt medikamentbehandling etter utposning på hovedpulsåren";"ki_I";0,85;0,74;1;"Etter behandling for utposning på hovedpulsåren bør det startes medikamentell behandling for å forebygge komplikasjoner som hjerneslag eller hjerteinfarkt.";"Etter behandling for utposning på hovedpulsåren bør det startes medikamentell behandling for å forebygge komplikasjoner som hjerneslag eller hjerteinfarkt. Nasjonale og internasjonale retningslinjer beskriver viktigheten av denne type behandling for karkirurgiske pasienter. 

Kvalitetsindikatoren er definert som andel pasienter mottar resept på kolesterolsenkende medikamenter og platehemmer, eller antikoagulasjon. En årsak til dårlig måloppnåelse er at det blir registrert ukjent medikamentbruk ved utskrivelse. Dvs at det i NORKAR ikke blir registrert type medikamenter pasienten benytter ved utskrivelse."
"norkarh";"norkar";"Behandlet innen 14 dager for forsnevring av halspulsåren";"ki_H";0,8;0,59;1;"Andel pasienter med for forsnevring av halspulsåren (carotisstenose) som mottar behandling for denne tilstanden innen 14 dager.";"Denne kvalitetsindikatoren er definert som andel pasienter med for forsnevring av halspulsåren (carotisstenose) som mottar behandling for denne tilstanden innen 14 dager etter symptomer. De som har hatt symptomer på hjerneslag, bør undersøkes av lege så snart som mulig etter hendelsen. Målet om rask identifisering og behandling av pasienter med cerebrovaskulære hendelser stiller store krav til logistikken ved sykehusene. 

Flere faktorer utenfor karkirurgens innflytelse påvirker indikatoren, som for eksempel tid til kontakt med lege og tid til henvisning til spesialist, slik at indikatoren sier noe om helseforetaket klarer å behandle pasienter med symptomatiske stenoser innenfor anbefalt tid. En må også være klar over at det finnes situasjoner hvor retningslinjene anbefaler å vente mer enn 14 dager, for eksempel etter store slag eller ved betydelig utfall, slik at verdien skal ikke være 100 %."
"norkarj";"norkar";"Anbefalt medikamentbehandling  etter forsnevring av halspulsåren";"ki_J";0,85;0,74;1;"Etter behandling for forsnevring av halspulsåren (carotisstenose) bør det startes medikamentell behandling for å forebygge komplikasjoner som hjerneslag eller hjerteinfarkt.";"Etter behandling for forsnevring av halspulsåren bør det startes medikamentell behandling for å forebygge komplikasjoner som hjerneslag eller hjerteinfarkt. Nasjonale og internasjonale retningslinjer beskriver viktigheten av denne type behandling for karkirurgiske pasienter. 

Kvalitetsindikatoren er definert som andel pasienter mottar resept på kolesterolsenkende medikamenter og platehemmer, eller antikoagulasjon. En årsak til dårlig måloppnåelse er sannsynligvis at det blir registrert ukjent medikamentbruk ved utskrivelse. Dvs at det i NORKAR ikke blir registrert type medikamenter pasienten benytter ved utskrivelse."
"norkark";"norkar";"Anbefalt medikamentbehandling   etter forsnevring av pulsårer i beina";"ki_K";0,85;0,74;1;"Etter behandling for forsnevring av halspulsåren (carotisstenose) bør det startes medikamentell behandling for å forebygge komplikasjoner som hjerneslag eller hjerteinfarkt.";"Etter behandling for forsnevring av pulsårer i beina bør det startes medikamentell behandling for å forebygge komplikasjoner som hjerneslag eller hjerteinfarkt. Nasjonale og internasjonale retningslinjer beskriver viktigheten av denne type behandling for karkirurgiske pasienter. 

Kvalitetsindikatoren er definert som andel pasienter mottar resept på kolesterolsenkende medikamenter og platehemmer, eller antikoagulasjon. En årsak til dårlig måloppnåelse er sannsynligvis at det blir registrert ukjent medikamentbruk ved utskrivelse. Dvs at det i NORKAR ikke blir registrer type medikamenter pasienten benytter ved utskrivelse."
"norkardga";"norkar";"Aktualitet";"ki_DGA";0,9;0,69;1;"Antall dager fra utskrivelse til ferdigstilt skjema";"Antall dager fra utskrivelse til ferdigstilt skjema"
